[
  {
    "id": "ai100-annual-2022-2023-087-gen2-quiz-1",
    "storylineId": "bench-council-ai100-2022-2023",
    "question": {
      "en": "Which area does the BenchCouncil annual table assign to Gen2?",
      "zh": "BenchCouncil 年度表把 Gen2 归入哪个领域？"
    },
    "options": [
      {
        "en": "Diffusion Model Application",
        "zh": "扩散模型应用"
      },
      {
        "en": "Vision",
        "zh": "视觉"
      },
      {
        "en": "Video",
        "zh": "视频"
      },
      {
        "en": "Speech",
        "zh": "语音"
      }
    ],
    "answer": 0,
    "explanation": {
      "en": "Gen2 appears in the Diffusion Model Application area of the official annual table.",
      "zh": "Gen2 位于官方年度表的“扩散模型应用”领域。"
    },
    "sourceIds": [
      "source-benchcouncil-annual"
    ],
    "assetIds": [
      "asset-annual-087-gen2-record"
    ]
  }
]
