[
  {
    "id": "ai100-annual-2022-2023-071-fine-tuning-quiz-1",
    "storylineId": "bench-council-ai100-2022-2023",
    "question": {
      "en": "Which area does the BenchCouncil annual table assign to Fine-Tuning?",
      "zh": "BenchCouncil 年度表把 Fine-Tuning 归入哪个领域？"
    },
    "options": [
      {
        "en": "Evaluation Analysis",
        "zh": "评测与分析"
      },
      {
        "en": "Vision",
        "zh": "视觉"
      },
      {
        "en": "Video",
        "zh": "视频"
      },
      {
        "en": "Speech",
        "zh": "语音"
      }
    ],
    "answer": 0,
    "explanation": {
      "en": "Fine-Tuning appears in the Evaluation Analysis area of the official annual table.",
      "zh": "Fine-Tuning 位于官方年度表的“评测与分析”领域。"
    },
    "sourceIds": [
      "source-benchcouncil-annual"
    ],
    "assetIds": [
      "asset-annual-071-fine-tuning-record"
    ]
  }
]
