[
  {
    "id": "ai100-annual-2022-2023-097-yolov7-quiz-1",
    "storylineId": "bench-council-ai100-2022-2023",
    "question": {
      "en": "Which area does the BenchCouncil annual table assign to YOLOv7?",
      "zh": "BenchCouncil 年度表把 YOLOv7 归入哪个领域？"
    },
    "options": [
      {
        "en": "Detection Segmentation",
        "zh": "检测与分割"
      },
      {
        "en": "Vision",
        "zh": "视觉"
      },
      {
        "en": "Video",
        "zh": "视频"
      },
      {
        "en": "Speech",
        "zh": "语音"
      }
    ],
    "answer": 0,
    "explanation": {
      "en": "YOLOv7 appears in the Detection Segmentation area of the official annual table.",
      "zh": "YOLOv7 位于官方年度表的“检测与分割”领域。"
    },
    "sourceIds": [
      "source-benchcouncil-annual"
    ],
    "assetIds": [
      "asset-annual-097-yolov7-record"
    ]
  }
]
